{"$schema":"https://json-schema.org/draft/2020-12/schema","title":"Prototype lineage baseline receipt","type":"object","required":["schemaVersion","receiptId","requirementId","previousManifest","previousSnapshot","buildMetadata","runtimeAudit","createdAt"],"properties":{"schemaVersion":{"const":"1.0.0"},"receiptId":{"type":"string","minLength":1},"requirementId":{"type":"string","minLength":1},"previousManifest":{"$ref":"#/$defs/input"},"previousSnapshot":{"$ref":"#/$defs/input"},"buildMetadata":{"$ref":"#/$defs/input"},"migrationDescriptor":{"$ref":"#/$defs/input"},"runtimeAudit":{"type":"object","required":["status","coreItemIds","customItems"],"properties":{"status":{"const":"pass"},"coreItemIds":{"type":"array","uniqueItems":true,"items":{"type":"string","minLength":1}},"customItems":{"type":"array","items":{"type":"object","required":["itemId","selector","sourceRefs"],"properties":{"itemId":{"type":"string","minLength":1},"selector":{"type":"string","minLength":1},"sourceRefs":{"type":"array","minItems":1}},"additionalProperties":false}}},"additionalProperties":false},"createdAt":{"type":"string","format":"date-time"}},"$defs":{"input":{"type":"object","required":["pathLabel","sha256"],"properties":{"pathLabel":{"type":"string","pattern":"^(?!/)(?!.*\\.\\.).+"},"sha256":{"type":"string","pattern":"^[a-f0-9]{64}$"}},"additionalProperties":false}},"additionalProperties":false}
