{"schemaVersion":"1.0.0","receiptId":"LINEAGE-BASELINE-001","requirementId":"EXAMPLE-REQ","previousManifest":{"pathLabel":"previous-manifest.json","sha256":"0000000000000000000000000000000000000000000000000000000000000000"},"previousSnapshot":{"pathLabel":"previous-reader.html","sha256":"0000000000000000000000000000000000000000000000000000000000000000"},"buildMetadata":{"pathLabel":"previous-reader.metadata.json","sha256":"0000000000000000000000000000000000000000000000000000000000000000"},"runtimeAudit":{"status":"pass","coreItemIds":["change-overview","collapse-expand-all","return-previous-prototype","full-development-snapshot","change-kind-color","current-location","bidirectional-visible-connector","fact-source-details"],"customItems":[]},"createdAt":"2026-09-29T00:00:00+08:00"}
